{
  "account": {
    "id": "56b9ca7f17025f8756f69054",
    "name": "My Company",
    "url": "https://app.bugsnag.com/accounts/my-company"
  },
  "project": {
    "id": "56b9ca7f17025f8756f69056",
    "name": "My Project",
    "url": "https://app.bugsnag.com/my-company/my-project"
  },
  "trigger": {
    "type": "firstException",
    "message": "A new error has occurred in your project My Project"
  },
  "error": {
    "id": "56b9ca7f17025f8756f69058",
    "url": "https://app.bugsnag.com/my-company/my-project/errors/56b9ca7f17025f8756f69058",
    "context": "auth/session#create",
    "firstReceived": "2015-11-27T15:26:11.000Z",
    "severity": "error",
    "status": "open",
    "createdIssue": {
      "id": "BUG123",
      "number": 3,
      "type": "bugify",
      "url": "http://demo.bugify.com/issues/3"
    }
  },
  "event": {
    "id": "56b9ca7f17025f8756f69054",
    "received": "2015-11-27T15:26:11.000Z",
    "user": {
      "id": "19",
      "name": "Robert Hawkins",
      "email": "bob@example.com"
    },
    "app": {
      "id": "com.bugsnag.android.example.debug",
      "version": "1.1.3",
      "versionCode": 14,
      "releaseStage": "production"
    },
    "device": {
      "hostname": "web1.internal",
      "id": "fd124e87760c4281aef",
      "manufacturer": "LGE",
      "model": "Nexus 5",
      "osName": "android",
      "osVersion": "4.4.4"
    },
    "exceptions": [
      {
        "errorClass": "android.util.Log.wtf",
        "message": "Something went terribly wrong",
        "stacktrace": [
          {
            "file": "MainActivity.java",
            "lineNumber": 123,
            "method": "crash"
          }
        ]
      }
    ]
  }
}
